{
  "agent_id": "toy_agent_driven_l1",
  "default_coord_space": "physical_px",
  "notes": "Toy runnable adapter that exports L1 agent_events for run_agent plumbing tests.",
  "action_evidence": {
    "level": "L1",
    "source": "agent_events",
    "event_stream": {
      "format": "agent_events_v1",
      "path_on_host": "agent_events.jsonl"
    }
  }
}
