{
  "agent_id": "minitap-mobile-use",
  "default_coord_space": "physical_px",
  "notes": "Minitap Mobile-Use (agent-driven) adapter. Exports L1 agent_events_v1 and writes MAS evidence bundles (screenshots + ui_dump).",
  "action_evidence": {
    "level": "L1",
    "source": "agent_events",
    "event_stream": {
      "format": "agent_events_v1",
      "path_on_host": "agent_events.jsonl"
    }
  }
}
