{
  "agent_id": "toy_agent_driven_l2",
  "default_coord_space": "physical_px",
  "notes": "Toy runnable adapter that emits L2 comm_proxy traffic for run_agent plumbing tests.",
  "action_evidence": {
    "level": "L2",
    "source": "comm_proxy",
    "event_stream": {
      "format": "comm_proxy_trace_v1",
      "path_on_host": "comm_proxy_trace.jsonl"
    }
  }
}
